[
  {
    "fleet": "chn-openstates-files",
    "config": "chn-openstates-files.yml",
    "state": "ak",
    "org": "govbot-data",
    "repo": "ak-legislation",
    "paused": true,
    "polled_at": "2026-10-02T02:10:25.290351+00:00",
    "workflows": [
      {
        "workflow": "extract-text.yml",
        "latest_conclusion": "success",
        "hours_since_success": 56.65
      },
      {
        "workflow": "format.yml",
        "latest_conclusion": "success",
        "hours_since_success": 56.66
      }
    ],
    "data_commit_age_hours": 56.65,
    "errors": []
  },
  {
    "fleet": "chn-openstates-files",
    "config": "chn-openstates-files.yml",
    "state": "al",
    "org": "govbot-data",
    "repo": "al-legislation",
    "paused": true,
    "polled_at": "2026-10-02T02:10:25.290351+00:00",
    "workflows": [
      {
        "workflow": "extract-text.yml",
        "latest_conclusion": "success",
        "hours_since_success": 57.0
      },
      {
        "workflow": "format.yml",
        "latest_conclusion": "success",
        "hours_since_success": 57.02
      }
    ],
    "data_commit_age_hours": 1732.83,
    "errors": []
  },
  {
    "fleet": "chn-openstates-files",
    "config": "chn-openstates-files.yml",
    "state": "ar",
    "org": "govbot-data",
    "repo": "ar-legislation",
    "paused": true,
    "polled_at": "2026-10-02T02:10:25.290351+00:00",
    "workflows": [
      {
        "workflow": "extract-text.yml",
        "latest_conclusion": "success",
        "hours_since_success": 304.89
      },
      {
        "workflow": "format.yml",
        "latest_conclusion": "success",
        "hours_since_success": 56.4
      }
    ],
    "data_commit_age_hours": 1735.26,
    "errors": []
  },
  {
    "fleet": "chn-openstates-files",
    "config": "chn-openstates-files.yml",
    "state": "az",
    "org": "govbot-data",
    "repo": "az-legislation",
    "paused": true,
    "polled_at": "2026-10-02T02:10:25.290351+00:00",
    "workflows": [
      {
        "workflow": "extract-text.yml",
        "latest_conclusion": "success",
        "hours_since_success": 56.64
      },
      {
        "workflow": "format.yml",
        "latest_conclusion": "success",
        "hours_since_success": 56.66
      }
    ],
    "data_commit_age_hours": 710.32,
    "errors": []
  },
  {
    "fleet": "chn-openstates-files",
    "config": "chn-openstates-files.yml",
    "state": "ca",
    "org": "govbot-data",
    "repo": "ca-legislation",
    "paused": true,
    "polled_at": "2026-10-02T02:10:25.290351+00:00",
    "workflows": [
      {
        "workflow": "extract-text.yml",
        "latest_conclusion": "success",
        "hours_since_success": 56.67
      },
      {
        "workflow": "format.yml",
        "latest_conclusion": "success",
        "hours_since_success": 56.69
      }
    ],
    "data_commit_age_hours": 59.33,
    "errors": []
  },
  {
    "fleet": "chn-openstates-files",
    "config": "chn-openstates-files.yml",
    "state": "co",
    "org": "govbot-data",
    "repo": "co-legislation",
    "paused": true,
    "polled_at": "2026-10-02T02:10:25.290351+00:00",
    "workflows": [
      {
        "workflow": "extract-text.yml",
        "latest_conclusion": "success",
        "hours_since_success": 56.73
      },
      {
        "workflow": "format.yml",
        "latest_conclusion": "success",
        "hours_since_success": 56.96
      }
    ],
    "data_commit_age_hours": 56.74,
    "errors": []
  },
  {
    "fleet": "chn-openstates-files",
    "config": "chn-openstates-files.yml",
    "state": "ct",
    "org": "govbot-data",
    "repo": "ct-legislation",
    "paused": true,
    "polled_at": "2026-10-02T02:10:25.290351+00:00",
    "workflows": [
      {
        "workflow": "extract-text.yml",
        "latest_conclusion": "success",
        "hours_since_success": 56.75
      },
      {
        "workflow": "format.yml",
        "latest_conclusion": "success",
        "hours_since_success": 56.76
      }
    ],
    "data_commit_age_hours": 1727.32,
    "errors": []
  },
  {
    "fleet": "chn-openstates-files",
    "config": "chn-openstates-files.yml",
    "state": "dc",
    "org": "govbot-data",
    "repo": "dc-legislation",
    "paused": false,
    "polled_at": "2026-10-02T02:10:25.290351+00:00",
    "workflows": [
      {
        "workflow": "extract-text.yml",
        "latest_conclusion": "success",
        "hours_since_success": 7.98
      },
      {
        "workflow": "format.yml",
        "latest_conclusion": "success",
        "hours_since_success": 8.0
      }
    ],
    "data_commit_age_hours": 14.26,
    "errors": []
  },
  {
    "fleet": "chn-openstates-files",
    "config": "chn-openstates-files.yml",
    "state": "de",
    "org": "govbot-data",
    "repo": "de-legislation",
    "paused": true,
    "polled_at": "2026-10-02T02:10:25.290351+00:00",
    "workflows": [
      {
        "workflow": "extract-text.yml",
        "latest_conclusion": "success",
        "hours_since_success": 56.28
      },
      {
        "workflow": "format.yml",
        "latest_conclusion": "success",
        "hours_since_success": 56.29
      }
    ],
    "data_commit_age_hours": 56.28,
    "errors": []
  },
  {
    "fleet": "chn-openstates-files",
    "config": "chn-openstates-files.yml",
    "state": "fl",
    "org": "govbot-data",
    "repo": "fl-legislation",
    "paused": true,
    "polled_at": "2026-10-02T02:10:25.290351+00:00",
    "workflows": [
      {
        "workflow": "extract-text.yml",
        "latest_conclusion": "success",
        "hours_since_success": 56.25
      },
      {
        "workflow": "format.yml",
        "latest_conclusion": "success",
        "hours_since_success": 56.27
      }
    ],
    "data_commit_age_hours": 1326.13,
    "errors": []
  },
  {
    "fleet": "chn-openstates-files",
    "config": "chn-openstates-files.yml",
    "state": "ga",
    "org": "govbot-data",
    "repo": "ga-legislation",
    "paused": true,
    "polled_at": "2026-10-02T02:10:25.290351+00:00",
    "workflows": [
      {
        "workflow": "extract-text.yml",
        "latest_conclusion": "success",
        "hours_since_success": 585.36
      },
      {
        "workflow": "format.yml",
        "latest_conclusion": "success",
        "hours_since_success": 56.97
      }
    ],
    "data_commit_age_hours": 1602.45,
    "errors": []
  },
  {
    "fleet": "chn-openstates-files",
    "config": "chn-openstates-files.yml",
    "state": "gu",
    "org": "govbot-data",
    "repo": "gu-legislation",
    "paused": false,
    "polled_at": "2026-10-02T02:10:25.290351+00:00",
    "workflows": [
      {
        "workflow": "extract-text.yml",
        "latest_conclusion": "success",
        "hours_since_success": 7.01
      },
      {
        "workflow": "format.yml",
        "latest_conclusion": "success",
        "hours_since_success": 7.03
      }
    ],
    "data_commit_age_hours": 7.02,
    "errors": []
  },
  {
    "fleet": "chn-openstates-files",
    "config": "chn-openstates-files.yml",
    "state": "hi",
    "org": "govbot-data",
    "repo": "hi-legislation",
    "paused": true,
    "polled_at": "2026-10-02T02:10:25.290351+00:00",
    "workflows": [
      {
        "workflow": "extract-text.yml",
        "latest_conclusion": "success",
        "hours_since_success": 7.82
      },
      {
        "workflow": "format.yml",
        "latest_conclusion": "success",
        "hours_since_success": 7.84
      }
    ],
    "data_commit_age_hours": 820.32,
    "errors": []
  },
  {
    "fleet": "chn-openstates-files",
    "config": "chn-openstates-files.yml",
    "state": "ia",
    "org": "govbot-data",
    "repo": "ia-legislation",
    "paused": true,
    "polled_at": "2026-10-02T02:10:25.290351+00:00",
    "workflows": [
      {
        "workflow": "extract-text.yml",
        "latest_conclusion": "success",
        "hours_since_success": 57.08
      },
      {
        "workflow": "format.yml",
        "latest_conclusion": "success",
        "hours_since_success": 57.1
      }
    ],
    "data_commit_age_hours": 61.92,
    "errors": []
  },
  {
    "fleet": "chn-openstates-files",
    "config": "chn-openstates-files.yml",
    "state": "id",
    "org": "govbot-data",
    "repo": "id-legislation",
    "paused": true,
    "polled_at": "2026-10-02T02:10:25.290351+00:00",
    "workflows": [
      {
        "workflow": "extract-text.yml",
        "latest_conclusion": "success",
        "hours_since_success": 56.83
      },
      {
        "workflow": "format.yml",
        "latest_conclusion": "success",
        "hours_since_success": 56.84
      }
    ],
    "data_commit_age_hours": 1734.51,
    "errors": []
  },
  {
    "fleet": "chn-openstates-files",
    "config": "chn-openstates-files.yml",
    "state": "il",
    "org": "govbot-data",
    "repo": "il-legislation",
    "paused": true,
    "polled_at": "2026-10-02T02:10:25.290351+00:00",
    "workflows": [
      {
        "workflow": "extract-text.yml",
        "latest_conclusion": "success",
        "hours_since_success": 56.26
      },
      {
        "workflow": "format.yml",
        "latest_conclusion": "success",
        "hours_since_success": 56.29
      }
    ],
    "data_commit_age_hours": 56.26,
    "errors": []
  },
  {
    "fleet": "chn-openstates-files",
    "config": "chn-openstates-files.yml",
    "state": "in",
    "org": "govbot-data",
    "repo": "in-legislation",
    "paused": true,
    "polled_at": "2026-10-02T02:10:25.290351+00:00",
    "workflows": [
      {
        "workflow": "extract-text.yml",
        "latest_conclusion": "success",
        "hours_since_success": 57.03
      },
      {
        "workflow": "format.yml",
        "latest_conclusion": "success",
        "hours_since_success": 57.05
      }
    ],
    "data_commit_age_hours": 57.03,
    "errors": []
  },
  {
    "fleet": "chn-openstates-files",
    "config": "chn-openstates-files.yml",
    "state": "ks",
    "org": "govbot-data",
    "repo": "ks-legislation",
    "paused": true,